{"$schema":"https://json-schema.org/draft/2020-12/schema","type":"object","required":["overall_score","dimensions","glyphs","review_recommended","confidence"],"properties":{"overall_score":{"type":"integer"},"dimensions":{"type":"object"},"glyphs":{"type":"array","items":{"type":"object","required":["candidate_id","canonical_name","score","action","adjustment","confidence","rationale"],"properties":{"candidate_id":{"type":"string"},"canonical_name":{"type":["string","null"]},"score":{"type":"integer"},"action":{"enum":["accept","adjust_scale","adjust_y","adjust_sidebearing","choose_variant","redo_mask","redo_trace","manual_review"]},"adjustment":{"type":"object"},"confidence":{"type":"number"},"rationale":{"type":"string"}}}},"review_recommended":{"type":"array"},"confidence":{"type":"number"}}}
