{
  "confidence": 0.2,
  "dimensions": {
    "accidental_noise": 40,
    "alphabet_completeness": 100,
    "identification_confidence": 20,
    "obvious_omissions": 100,
    "scale_coherence": 50,
    "source_fidelity": 40,
    "spacing_coherence": 50,
    "tracing_quality": 40
  },
  "glyphs": [
    {
      "action": "manual_review",
      "adjustment": {},
      "candidate_id": "g-row01-col01-v01",
      "canonical_name": "aleph",
      "confidence": 0.2,
      "rationale": "AI-disabled QA; visual judgment not performed",
      "score": 40
    },
    {
      "action": "manual_review",
      "adjustment": {},
      "candidate_id": "g-row01-col02-v01",
      "canonical_name": "bet",
      "confidence": 0.2,
      "rationale": "AI-disabled QA; visual judgment not performed",
      "score": 40
    },
    {
      "action": "manual_review",
      "adjustment": {},
      "candidate_id": "g-row01-col03-v01",
      "canonical_name": "gimel",
      "confidence": 0.2,
      "rationale": "AI-disabled QA; visual judgment not performed",
      "score": 40
    },
    {
      "action": "manual_review",
      "adjustment": {},
      "candidate_id": "g-row01-col04-v01",
      "canonical_name": "dalet",
      "confidence": 0.2,
      "rationale": "AI-disabled QA; visual judgment not performed",
      "score": 40
    },
    {
      "action": "manual_review",
      "adjustment": {},
      "candidate_id": "g-row01-col05-v01",
      "canonical_name": "he",
      "confidence": 0.2,
      "rationale": "AI-disabled QA; visual judgment not performed",
      "score": 40
    },
    {
      "action": "manual_review",
      "adjustment": {},
      "candidate_id": "g-row01-col06-v01",
      "canonical_name": "waw",
      "confidence": 0.2,
      "rationale": "AI-disabled QA; visual judgment not performed",
      "score": 40
    },
    {
      "action": "manual_review",
      "adjustment": {},
      "candidate_id": "g-row01-col07-v01",
      "canonical_name": "zayin",
      "confidence": 0.2,
      "rationale": "AI-disabled QA; visual judgment not performed",
      "score": 40
    },
    {
      "action": "manual_review",
      "adjustment": {},
      "candidate_id": "g-row01-col08-v01",
      "canonical_name": "het",
      "confidence": 0.2,
      "rationale": "AI-disabled QA; visual judgment not performed",
      "score": 40
    },
    {
      "action": "manual_review",
      "adjustment": {},
      "candidate_id": "g-row01-col09-v01",
      "canonical_name": "tet",
      "confidence": 0.2,
      "rationale": "AI-disabled QA; visual judgment not performed",
      "score": 40
    },
    {
      "action": "manual_review",
      "adjustment": {},
      "candidate_id": "g-row01-col10-v01",
      "canonical_name": "yod",
      "confidence": 0.2,
      "rationale": "AI-disabled QA; visual judgment not performed",
      "score": 40
    },
    {
      "action": "manual_review",
      "adjustment": {},
      "candidate_id": "g-row01-col11-v01",
      "canonical_name": "kaf",
      "confidence": 0.2,
      "rationale": "AI-disabled QA; visual judgment not performed",
      "score": 40
    },
    {
      "action": "manual_review",
      "adjustment": {},
      "candidate_id": "g-row01-col12-v01",
      "canonical_name": "lamed",
      "confidence": 0.2,
      "rationale": "AI-disabled QA; visual judgment not performed",
      "score": 40
    },
    {
      "action": "manual_review",
      "adjustment": {},
      "candidate_id": "g-row01-col13-v01",
      "canonical_name": "mem",
      "confidence": 0.2,
      "rationale": "AI-disabled QA; visual judgment not performed",
      "score": 40
    },
    {
      "action": "manual_review",
      "adjustment": {},
      "candidate_id": "g-row01-col14-v01",
      "canonical_name": "nun",
      "confidence": 0.2,
      "rationale": "AI-disabled QA; visual judgment not performed",
      "score": 40
    },
    {
      "action": "manual_review",
      "adjustment": {},
      "candidate_id": "g-row01-col15-v01",
      "canonical_name": "samekh",
      "confidence": 0.2,
      "rationale": "AI-disabled QA; visual judgment not performed",
      "score": 40
    },
    {
      "action": "manual_review",
      "adjustment": {},
      "candidate_id": "g-row01-col16-v01",
      "canonical_name": "ayin",
      "confidence": 0.2,
      "rationale": "AI-disabled QA; visual judgment not performed",
      "score": 40
    },
    {
      "action": "manual_review",
      "adjustment": {},
      "candidate_id": "g-row01-col17-v01",
      "canonical_name": "pe",
      "confidence": 0.2,
      "rationale": "AI-disabled QA; visual judgment not performed",
      "score": 40
    },
    {
      "action": "manual_review",
      "adjustment": {},
      "candidate_id": "g-row01-col18-v01",
      "canonical_name": "tsade",
      "confidence": 0.2,
      "rationale": "AI-disabled QA; visual judgment not performed",
      "score": 40
    },
    {
      "action": "manual_review",
      "adjustment": {},
      "candidate_id": "g-row01-col19-v01",
      "canonical_name": "qof",
      "confidence": 0.2,
      "rationale": "AI-disabled QA; visual judgment not performed",
      "score": 40
    },
    {
      "action": "manual_review",
      "adjustment": {},
      "candidate_id": "g-row01-col20-v01",
      "canonical_name": "resh",
      "confidence": 0.2,
      "rationale": "AI-disabled QA; visual judgment not performed",
      "score": 40
    },
    {
      "action": "manual_review",
      "adjustment": {},
      "candidate_id": "g-row01-col21-v01",
      "canonical_name": "shin",
      "confidence": 0.2,
      "rationale": "AI-disabled QA; visual judgment not performed",
      "score": 40
    },
    {
      "action": "manual_review",
      "adjustment": {},
      "candidate_id": "g-row01-col22-v01",
      "canonical_name": "taw",
      "confidence": 0.2,
      "rationale": "AI-disabled QA; visual judgment not performed",
      "score": 40
    }
  ],
  "overall_score": 40,
  "review_recommended": [
    "aleph",
    "bet",
    "gimel",
    "dalet",
    "he",
    "waw",
    "zayin",
    "het",
    "tet",
    "yod",
    "kaf",
    "lamed",
    "mem",
    "nun",
    "samekh",
    "ayin",
    "pe",
    "tsade",
    "qof",
    "resh",
    "shin",
    "taw"
  ]
}
